"Id";"Score";"text";"data"
"1";1;"0.523769378662109";"AméricaMG tem conversas avançadas com o Flamengo para contratar o goleiro Thiago diz jornalista …";2019-05-14 21:37:14
"2";2;"0.597347557544708";"Maurício Barbieri é anunciado como novo técnico do AméricaMG";2019-05-06 18:30:08
"3";3;"0.476214855909348";"SérieB
Clubes que ficaram mais jogos sem marcar nas partidas iniciais pts corridos
Vila Novajogos in…";2019-05-14 23:26:09
"4";4;"0.460776269435883";"Sander volta a treinar e deve reforçar Sport contra AméricaMGsportGloboesporte";2019-05-14 23:23:52
"5";5;"0.523769378662109";"AméricaMG tem conversas avançadas com o Flamengo para contratar o goleiro Thiago diz jornalista";2019-05-14 23:14:28
"6";6;"0.108139663934708";"Ah mano tem coisas que não da véi se eles discutirem com um torcedor do América MG ate da liga";2019-05-14 23:08:27
"7";7;"0.557197153568268";"Colorada ano que vem tem a serie B de novo…";2019-05-14 22:54:08
"8";8;"0.518886208534241";"América MG

Paraná mesmo Estado";2019-05-14 22:51:42
"9";9;"0.57438850402832";"Time da Série B abre negociação para contratar goleiro do Flamengo";2019-05-14 22:40:41
"10";10;"0.523769378662109";"AméricaMG tem conversas avançadas com o Flamengo para contratar o goleiro Thiago diz jornalista…";2019-05-14 22:36:46
"11";11;"0.516368806362152";"Fla
Goleiro Thiago deve ir para o América Mg até o fim do ano
Fonte Twitter Venê Casagrande";2019-05-14 22:36:34
"12";12;"0.240168392658234";"America MG x flamengo no Horto
America MG x palmeiras no estadio do café
Aqui não teve beneficiado Kkkk";2019-05-14 22:05:08
"13";13;"0.546183884143829";"Barbieri e técnico do América MG";2019-05-14 21:59:46
"14";14;"0.739513158798218";"Com gratuidade para mulheres e crianças América divulga detalhes da venda de ingressos para duelo com o SportSu…";2019-05-14 21:55:27
"15";15;"0.4998659491539";"Goleiro Thiago deve ir para o América Mg até o fim do ano";2019-05-14 21:52:26
"16";16;"0.523769378662109";"AméricaMG tem conversas avançadas com o Flamengo para contratar o goleiro Thiago diz jornalista…";2019-05-14 21:49:45
"17";17;"0.335368245840073";"Eu até acho errado mas vejo duas frentes nisso

 O clube arrecada umque Vai ser im…";2019-05-14 21:45:25
"18";18;"0.643206775188446";"O goleiro Thiago tá de malas prontas para MG O destino é o AméricaMg O goleiro é uma indicação de Barbierinovo técnico do…";2019-05-14 21:43:51
"19";19;"0.67403507232666";"O goleiro Thiago tá de malas prontas para MG O destino é o AméricaMg O goleiro é uma indicação de Barbierinovo técnico do clube";2019-05-14 21:32:34
"20";20;"0.536206483840942";"Meia do América MG kk";2019-05-14 21:31:08
"21";21;"0.868478238582611";"Bemeu acompanhei a estreia do Barbieri e achei o Goleiro do América MG bem seguroJoryseria uma…";2019-05-14 21:29:48
"22";22;"0.185347199440002";"América MG ídolo 

maior volante da história aqui seu merda";2019-05-14 20:51:48
"23";23;"0.564524054527283";"Capitão do América MG";2019-05-14 20:49:58
"24";24;"0.537532687187195";"AméricaMG está negociando o empréstimo do goleiro Thiago do Flamengo";2019-05-14 20:49:51
"25";25;"0.23032408952713";"Gandula do América MG <U+0001F614>";2019-05-14 20:24:34
"26";26;"0.92299872636795";"CAMPANHA NO BrasileirãoSub

Internacional x Grêmio
Grêmio x América MG
Grêmio x Vitória
São Paulo x Grêmio

P…";2019-05-14 20:20:12
"27";27;"0.582947671413422";"Seria ídolo do América MG kkk";2019-05-14 20:18:39
"28";28;"0.531015992164612";"América MG vendeu pra Londrina o jogo com o Palmeiras ano passadoTá lembradoSempre rola isso Todo ano";2019-05-14 20:02:53
"29";29;"0.0759983062744141";"Pois é mas esqueceram de reclamar quando o America MG vendeu o jogo contra o Palmeiras Deu nisso";2019-05-14 19:49:44
"30";30;"0.369012534618378";"expedientefutebolano passado o Palmeiras não jogou em Londrina contra o América MG Cada um com…";2019-05-14 19:45:42
"31";31;"0.546490669250488";"Vc falou algum momento atrás sobre propostas pro América MG e outro tim…";2019-05-14 19:40:41
"32";32;"0.532539427280426";"América MG";2019-05-14 19:08:44
"33";33;"0.976190447807312";"Amanhã inter x América MG pelo campeonato brasileiro sub que deus nos abençoe e possamos sair com a vitória<U+0001F64F><U+0001F3FC>LF";2019-05-14 19:03:26
"34";34;"0.532539427280426";"América mg";2019-05-14 19:01:50
"35";35;"0.940295279026031";"CAMPANHA NO BrasileirãoSub

Internacional x Grêmio
Grêmio x América MG
Grêmio x Vitória
São Paulo x Grêm…";2019-05-14 18:49:37
"36";36;"0.517021656036377";"América MG e CSA já disputam a contratação";2019-05-14 18:32:43
"37";37;"0.699545502662659";"Pensando em continuidade no AméricaMG Pedrão comemora oportunidade dada por Barbieri";2019-05-14 18:29:41
"38";38;"0.546183884143829";"FIM DE JOGO Criciúma e América MG empatam ema<U+0001F634>";2019-05-14 18:24:56
"39";39;"0.195191115140915";"Agora que o América MG mudou de técnico e o sobrenome dele é Barbieri os heteros ficam tudo puxando papo comigo <U+0001F612>";2019-05-14 17:30:18
"40";40;"0.589109480381012";"O atacante deve ficar no banco de reservas contra os mineiros e deve ser utilizado no segundo tempo";2019-05-14 16:38:34
"41";41;"0.40703085064888";"Hyuri cumpre suspensão e enfim pode estrear pelo Sport contra o AméricaMGsportGloboesporte";2019-05-14 16:02:29
"42";42;"0.706053614616394";"flu x palmeiras
flu x sp
flu x sp
flu x Grêmio
 flu x cap
flu x…";2019-05-14 15:55:18
"43";43;"0.532539427280426";"técnico do américa mg kkkkkkk";2019-05-14 15:09:31
"44";44;"0.482586860656738";"atacante do america mg q faaade";2019-05-14 14:51:53
"45";45;"0.532539427280426";"Ídolo do América MG <U+0001F605>";2019-05-14 14:09:59
"46";46;"0.532539427280426";"Goleiro do America MG";2019-05-14 14:01:46
"47";47;"0.247491955757141";"ver os jogos do america mg só pra acompanhar meu tecnico <U+0001F614>";2019-05-14 13:41:28
"48";48;"0.532539427280426";"Gandula do AMERICA Mg";2019-05-14 13:07:24
"49";49;"0.440870136022568";"Lateral do America MG pqp";2019-05-14 12:10:17
"50";50;"0.741992115974426";"Com gratuidade para mulheres e crianças América divulga detalhes da venda de ingressos para duelo com o Sport";2019-05-14 11:25:27
"51";51;"0.551990032196045";"América anuncia Mauricio Barbieri como novo treinador para sequência da Série B";2019-05-06 18:27:55
"52";52;"0.635538637638092";"OFICIAL

Maurício Barbieri é o novo treinador do américaMG";2019-05-06 18:24:58
"53";53;"0.475069940090179";"Ainda à espera de novo técnico América treina em dois períodos para duelo com o Criciúma";2019-05-06 18:06:01
"54";54;"0";"ESCUTA NO RADINHO SEU NUTELLA E PARA DE CHORAR NA NET SEU CHORAOP BUNDA MOLESEU TIME DEPENDE DA GL…";2019-05-06 17:12:52
"55";55;"0.532539427280426";"milhoes Chinacsa
 milhoes chinaamerica mg";2019-05-06 17:09:21
"56";56;"0.542174398899078";"Ricardo Silva que disputou a Série A do ano passado pelo América está próximo de acerto para retornar ao clube Já fez ex…";2019-05-06 16:20:24
"57";57;"0.591289758682251";"Ele e um bom zagueiro mas seus pares nunca ajudava Durval com reumatismo no Sport e P…";2019-05-06 15:57:49
"58";58;"0.344680368900299";"Falando sério Pq essa migração do nada dos empresários querendo investir em clubes daqui Améric…";2019-05-06 15:55:39
"59";59;"0.553941130638123";"Diretoria do AméricaMG avalia entrada de investidores estrangeiros no futebol do clube";2019-05-06 14:52:43
"60";60;"0.645714640617371";"Série B Exzagueiro de Guarani e Ponte Preta deve trocar AméricaMG pelo Vila Nova";2019-05-06 13:00:00
"61";61;"0.397391617298126";"Ja foi pro America MG";2019-05-06 12:34:00
"62";62;"0.605726480484009";"Ricardo Silva que disputou a Série A do ano passado pelo América está próximo de acerto para retornar ao clube J…";2019-05-06 12:24:39
"63";63;"0.593719959259033";"Zagueiro notasupriria saída do Bressan E se não me engano estava ou no América MG ou no Criciúma 

Teria vind…";2019-05-06 12:23:38
"64";64;"0.450649440288544";"Zagueiro Ricardo Silva faz exames para assinar por empréstimo com o AméricaMG até dezembro";2019-05-06 12:08:22
"65";65;"0.554752945899963";"Classificação da Série B continuação

Sportpt
Vila Novapt
Criciúmapt
São Bento…";2019-05-06 11:40:03
"66";66;"0.531796813011169";"AméricaMG confirma negociação avançada com técnico Maurício Barbieri";2019-05-06 11:34:21
"67";67;"0.39172637462616";"Pelarodada da Série B tivemos

Ter 
América MGxBotafogo SP

Qua 
Oeste SPxGuaran…";2019-05-06 11:18:43
"68";68;"0.542661607265472";"Foi cogitado no Vasco e fechou com o América MG Que fase";2019-05-06 11:16:45
"69";69;"0.524110794067383";"<U+0001F1E7><U+0001F1F7>Brasileirão Série B 

Classificação após aRodada

 Criciúma SCpts
 São Bento SP 
 Ponte Preta…";2019-05-06 10:13:28
"70";70;"0.562809109687805";"América MG Corinthians ou Cruzeiro";2019-05-06 08:59:09
"71";71;"0.59453296661377";"Mauricio Barbieri é o nome para substituir Givanildo Oliveira no América";2019-05-06 08:45:07
"72";72;"0.54886656999588";"Sim se nao me engano a gente empatou com o Vitoria fora venceu o America MG e depois perdeu pra…";2019-05-06 07:57:45
"73";73;"0.450789660215378";"Caiu duas vezes e dai e se ela conta que série B é título e dai Men…";2019-05-06 01:41:14
"74";74;"0.651820063591003";"Oi André Sugestão de pauta para semanaoferta do exterior chineses etc à clubes como o CSA e Amér…";2019-05-05 22:49:41
"75";75;"0.876847624778748";"America MG
Clube acerta com téc Mauricio Barbieri";2019-05-05 22:20:11
"76";76;"0.577417314052582";"AméricaMG negocia parceria de Rmilhões com grupo chinês Futeboteco";2019-05-05 22:07:22
"77";77;"0.752041578292847";"Acho que seria interessante Grêmio busca zagueiros mais jovens para o banco como por exemplo Messia…";2019-05-05 22:05:57
"78";78;"0.876847624778748";"America MG
Clube acerta com téc Mauricio Barbieri <U+0001F602><U+0001F602><U+0001F602><U+0001F602> ForaABEL ForaRenato";2019-05-05 21:47:56
"79";79;"0.916666686534882";"Glória a Deus pela viagem tranquila Foco total no treino de amanhã e no jogo de terça feira contra o América MG <U+0001F64F><U+0001F3FB><U+0001F64F><U+0001F3FB>";2019-05-05 21:13:56
"80";80;"0.499668151140213";"Esse jogo me lembra Bolívar xAthletico na Libertadores 

Ou seria Athletico x América MG em";2019-05-05 20:53:19
"81";81;"0.681126892566681";"Barbieri no América MG Bompara os dois Time se pressão da torcida organizado base forte Acho que se ele vai b…";2019-05-05 20:39:32
"82";82;"0.565464615821838";"Flu x america mg penalti pra eles";2019-05-05 20:29:19
"83";83;"0.354882121086121";"Aí Jeff o trem é tão feio que vc sabia que o Goiás só existe porque o AméricaMg emprestou o unifo…";2019-05-05 20:28:50
"84";84;"0.521338701248169";"Deve ser o América MG";2019-05-05 20:23:21
"85";85;"0.508441507816315";"América MG né Ou América do";2019-05-05 20:17:01
"86";86;"0.532539427280426";"Rival america mg";2019-05-05 19:46:31
"87";87;"0.339279145002365";"JC fez mais pelo Flu hj do q na última temporada kkkkkkkk tô zoando ele foi mt importante naquele pênalti contra o América mg";2019-05-05 19:42:08
"88";88;"0.525158226490021";"De agora em diante eu vou fazer igual meu pai desistir do Fluminense e torcer pro América MG FODASE";2019-05-05 19:39:24
"89";89;"0.456916153430939";"Rebaixado com o América MG Como acharam que daria certo";2019-05-05 19:36:33
"90";90;"0.649958670139313";"Sugestões de licenciamentos para o Pesclubes soltosVitoria BA Sport Recife América MG Paraná Club Es…";2019-05-05 19:28:28
"91";91;"0.603799939155579";"Diante dos tradicionais Emelec Huracan e Deportivo Lara LDU e San José são como o América MG";2019-05-05 18:53:15
"92";92;"0.499150276184082";"Substituto pro Alex Silva Iria atrás do Leandro Silva Tá no América MG";2019-05-05 18:42:06
"93";93;"0.427786707878113";"Missão do AméricaMG é reagir para evitar pior início do clube na Série B em pontos corridos";2019-05-05 18:41:40
"94";94;"0.693631291389465";"Palmeiras nãoPalmeiras tropeça sempre com um ou outro Chapecoense dentro de casa Paraná amer…";2019-05-05 18:30:13
"95";95;"0.320275038480759";"O SP tropeçou hoje empatar com o time C do cheirinho em casa é ruim Pontos corridos vc não pode perder…";2019-05-05 18:18:27
"96";96;"0.548059701919556";"Lembra do Brq na última rodada do primeiro turno só precisavamos vencer o lanterna América MG q só…";2019-05-05 18:09:10
"97";97;"0.405117452144623";"CSA é o América MGcomplicando a vida do Santos desde sempre";2019-05-05 18:07:53
"98";98;"0.542296588420868";"Ano passado empatamos com

Paraná
América MG

Fomos campeões";2019-05-05 18:02:32
"99";99;"0.480225682258606";"AS BOMBAS DO NGÃO GAMERAMERICA MG NOVO RICO MIRANDA NO SÃO PAULO E";2019-05-05 17:41:23
"100";100;"0.450517147779465";"Avisa o Rogério Ceni que o América MG tá sem técnico";2019-05-05 17:37:56
"101";101;"0.499150276184082";"esse jogo tá igualzinho ao do América Mg empqp";2019-05-05 17:11:12
"102";102;"0.473357558250427";"E também jogou no América MG";2019-05-05 15:55:12
"103";103;"0.379937082529068";"O discurso do Melo e do Odair é do America MG 

Enaltecendo Palmeiras dificil jogar lá e sei mais o que";2019-05-05 15:37:43
"104";104;"0.374567687511444";"<U+26BD><U+FE0F>SerieB<U+26BD><U+FE0F>
America MG 
BotafogoSP";2019-05-05 14:42:32
"105";105;"0.573294997215271";"Alt Mineiro x America MG";2019-05-05 14:30:37
"106";106;"0.635027647018433";"Só uma correção tem muita gente confundido

Felipão no Brasileiro está invicto ajogos
Palmeiras no Brasileiro…";2019-05-05 14:28:54
"107";107;"0.617846667766571";"América admite conversas com investidores interessados em parceria no futebol profissional";2019-05-05 14:21:28
"108";108;"0.481485605239868";"Pensamos como esses que empobrece o futebolac…";2019-05-05 12:24:26
