"Id";"Score";"text";"data"
"1";1;"0.387901425361633";"Na partida de sábado contra o Tupi Mano Menezes e sua Comissão Técnica completaramvitórias a frente do…";2019-03-18 15:56:32
"2";2;"1";"Bom dia Nação Azul <U+0001F535><U+26AA><U+FE0F><U+0001F98A>
Depois da vitória sábado o Cruzeiro mantém os trabalhos com foco total no Campeonato M…";2019-03-18 09:15:21
"3";3;"0.373780608177185";"Na quartafeira o Cruzeiro estreia na Copa do Brasil Sub fora de casa contra o ConfiançaSE 

O atacante Ran…";2019-03-19 09:00:00
"4";4;"0.653786540031433";"Um dos heróis dos anostroca idade hoje
Polivalente guerreiro autor de gol de título nacional

Esse é CLEISSON…";2019-03-19 19:19:58
"5";5;"0.8642697930336";"<U+26BD><U+FE0F> Cruzeiro terá o pedido atendido e vai jogar o duelo das quartasdefinal do Mineiro no sábado às h no Mineirão…";2019-03-19 19:14:53
"6";6;"0.269481956958771";"Caniggia já dizia Lá Bestia Negra del continente Cruzeiro";2019-03-19 18:47:54
"7";7;"0";"Será que só eu tô passando mal de ansiedade pra chegar o próximo jogo do Cruzeiro na LibertadoresCruzeiro";2019-03-19 18:32:25
"8";8;"0.393741965293884";"Na partida de sábado contra o Tupi Mano Menezes e sua Comissão Técnica completaramvitórias a frente do Cruzeiro

Para…";2019-03-19 18:23:16
"9";9;"0.8642697930336";"<U+26BD><U+FE0F> Cruzeiro terá o pedido atendido e vai jogar o duelo das quartasdefinal do Mineiro no sábado às h no Minei…";2019-03-19 18:08:06
"10";10;"0.542785048484802";"<U+26BD><U+FE0F> Cruzeiro fecha a preparação para encarar a Caldense com treino agora na Toca II Sidnei Lobo comanda a atividade já…";2019-03-19 18:00:39
"11";11;"0.502121448516846";"A TECNOLOGIA PRECISA DE TECNOLOGIA";2019-03-19 18:00:13
"12";12;"0.430990546941757";"Tivemos que criar uma campanha no curso escolhemos um tema atual que deve ser dado uma importância muito maior 

NO ESTÁD…";2019-03-19 17:31:59
"13";13;"0.675459325313568";"Grande reforço para a equipe Digi CruzeiroRaposão e Raposinho mostrando para os torcedores doque a N…";2019-03-19 16:57:28
"14";14;"0.373780608177185";"Na quartafeira o Cruzeiro estreia na Copa do Brasil Sub fora de casa contra o ConfiançaSE 

O atacante Raniel mandou…";2019-03-19 16:48:29
"15";15;"0.5";"Cruzeiro <U+0001F535><U+26AA>
Cruzeiro";2019-03-19 16:32:19
"16";16;"0.5";"Cruzeiro <U+0001F535><U+26AA> 
cruzeiro";2019-03-19 16:31:48
"17";17;"0.492214560508728";"<U+26BD><U+FE0F> Cruzeiro fecha a preparação para encarar a Caldense com treino agora na Toca II Sidnei Lobo comanda a atividad…";2019-03-19 15:49:51
"18";18;"0.592935264110565";"Saiu mais precificações de jogadores do cartola fc comenta o que acharam

cartolafc cartolafccartola …";2019-03-19 15:40:34
"19";19;"1";"José o cruzeirense<U+0001F631><U+0001F631><U+0001F423><U+0001F425><U+0001F60D><U+0001F618><U+0001F499><U+2764><U+FE0F>
“Canta pra mamãe amor”<U+0001F497><U+0001F497>

cruzeiro nature Deusnocontrole";2019-03-19 15:38:19
"20";20;"0.592935264110565";"Saiu mais precificações de jogadores do cartola fc comenta o que acharam

cartolafc cartolafc…";2019-03-19 15:36:57
"21";21;"0.581680178642273";"Informações sobre o Cruzeiro com o repórter";2019-03-19 15:24:07
"22";22;"1";"Meu sorriso quando lembro que amanhã tem CRUZEIROOOOO <U+0001F601><U+0001F499>
Por toda vida vou te acompanhar <U+0001F3B5><U+0001F499><U+0001F43A>
Cruzeiro…";2019-03-19 14:59:53
"23";23;"0.531796813011169";"Afez uma critica com indireta ao Vice Presidente Itair Machado do Cruzeiro";2019-03-19 14:51:43
"24";24;"0.0894945859909058";"Adversário do Cruzeiro na Libertadores sofre gol bizarro e segue em crise Veja o vídeo Cruzeiro SuperFC Libertadore…";2019-03-19 14:44:57
"25";25;"0.143719434738159";"É uma VERGONHA para ae para os clubes brasileiro não mandar seus treinadores para a reunião na…";2019-03-19 14:34:00
"26";26;"0.424403190612793";"Sem cara de sonoSimbora treinar <U+0001F3CB><U+0001F3FB><U+200D><U+2640><U+FE0F><U+0001F3D0>
Não é não galera <U+0001F644><U+0001F644>



volei sadacruzeiro paixao volei…";2019-03-19 14:17:49
"27";27;"0.471838057041168";"Gostaria de Alexandre Pato no Cruzeirofechadocomocruzeiro nasbatalhascomocruzeiro raposasegueraposasdv raposaseguer…";2019-03-19 14:06:53
"28";28;"0.508959352970123";"Olha aí as torcedoras do Cruzeiro no estádio 


Mariaboleira RespeitaAsMina ParaCegoVer Cruzeiro Mulheresnofuteb…";2019-03-19 14:04:41
"29";29;"0.471838057041168";"Gostaria de Alexandre Pato no Cruzeirofechadocomocruzeiro nasbatalhascomocruzeiro raposasegueraposasdv raposasegueraposa";2019-03-19 13:34:42
"30";30;"0.706281125545502";"Alô Nação Azul 
Confira a minha colunaNo pedacinho que a Galera gosta no caderno de esportes …";2019-03-19 13:22:36
"31";31;"0.5";"SacoCheioFC manto do Cruzeiro";2019-03-19 13:19:52
"32";32;"0.556977450847626";"Emde dezembro deAncelmo Ramon e Wellington Paulista jogaram juntos com a camisa do Cruzeiro pelo Campeona…";2019-03-19 13:16:08
"33";33;"0.548312425613403";"Uniformeusada em jogo único pelo Robinho Boca Juniors x Cruzeiro pela libertadores
Ano 
Forneced…";2019-03-19 13:16:08
"34";34;"0.556977450847626";"Emde dezembro deAncelmo Ramon e Wellington Paulista jogaram juntos com a camisa do Cruze…";2019-03-19 13:15:31
"35";35;"0.0894945859909058";"Adversário do Cruzeiro na Libertadores sofre gol bizarro e segue em crise Veja o vídeo Cruzeiro SuperFC…";2019-03-19 13:13:58
"36";36;"0.552556037902832";"Cruzeiro O técnico Mano Menezes compareceu hoje ao encontro de treinadores promovido pela Conmebol em sua sede no Paraguai";2019-03-19 13:13:42
"37";37;"0.141212373971939";"Ridículo é um pai ou uma mãe forçar o filho a torcer para o mesmo time que eleela Quando eu tiver um filho ele t…";2019-03-19 12:47:48
"38";38;"0.409360468387604";"Mano Menezes marcando presença no encontro de treinadores promovido pelaLevir Culpi já havia anunciado que n…";2019-03-19 12:03:51
"39";39;"0.534367442131042";"Mano vai ao Paraguai para reunião dos técnicos com presidente da Conmebol SuperFC Conmebol ManoMenezes Cruzeiro…";2019-03-19 11:51:19
"40";40;"0.505635559558868";"Descubra onde Thiago Neves deseja encerra sua carreira gt";2019-03-19 11:45:02
"41";41;"0.813066601753235";"Quem é o único invicto entre ostimes da série A no Brasil vou logo colocar o nome aqui Cruzeiro";2019-03-19 11:34:07
"42";42;"0.640192151069641";"Após três meses Cruzeiro segue como único invicto entre osmaiores do país SuperFC Cruzeiro Invencibilidade Mai…";2019-03-19 11:27:28
"43";43;"0.622190237045288";"O Huracán completou ontem nove partidas sem vencer dessa vez derrotado pelo Estudiantes poraSe liga no gol…";2019-03-19 11:15:20
"44";44;"0.533248066902161";"Fred marca quinto gol eme já supera temporada de volta ao Cruzeiro SuperFC Cruzeiro Fred Artilheiro…";2019-03-19 11:06:30
"45";45;"0.640192151069641";"Após três meses Cruzeiro segue como único invicto entre osmaiores do país SuperFC Cruzeiro Invencibilidade…";2019-03-19 11:01:51
"46";46;"0.564381778240204";"Douro turismo cruzeiro Portugal <U+0001F6F3><U+FE0F><U+0001F1F5><U+0001F1F9><U+0001F304> CroisiEurope inaugura novo navio para navegar no Douro A CroisiEurope companh…";2019-03-19 10:59:01
"47";47;"0.508817911148071";"Em menos demeses Cruzeiro superatimes da série A e B entenda SuperFC Cruzeiro SerieA SerieB…";2019-03-19 10:56:49
"48";48;"0.544855773448944";"Mano Menezes marcando presença no encontro de treinadores promovido pelaLevir Culpi já havia anunciado…";2019-03-19 10:54:17
"49";49;"0.542450189590454";"Quer saber das notícias do Cruzeiro opinião dos torcedores e participar de um Programa Ao Vivo
Acompanhe o Guerreiros e…";2019-03-18 09:11:28
"50";50;"0.454405725002289";"Quer saber das notícias do Cruzeiro opinião dos torcedores e participar de um Programa Ao Vivo
Acompanhe o Guerre…";2019-03-18 09:00:33
"51";51;"1";"Esse cara jamais deixou menos quede sua entrega em campo ou fora dele
Feliz aniversário ADILSON

Felicidades s…";2019-03-18 08:33:34
"52";52;"0.71876448392868";"Aagradece a todos os departamentos do Cruzeiro que nos proporcionaram momentos únicos toda vez que vem na cidade…";2019-03-18 08:24:05
"53";53;"0.761264622211456";"Até a rodada deste fim de semana apenasclubes da primeira divisão do campeonato brasileiro estavam invicto em …";2019-03-18 08:23:12
"54";54;"0.960311472415924";"Alcançamos a marca demil seguidores no Instagram Obrigado nação azul DiretoriaCeleste Cruzeiro AturaOuSurta";2019-03-18 07:49:23
"55";55;"0.973295629024506";"Existe melhor presentede aniversario 
Manto sagrado
cruzeiro presente naçãoazul RaposaSegueRaposa…";2019-03-18 07:00:15
"56";56;"0.346784114837646";"DIEGO ‘Serelepe’ foi mais uma das promessas da base em que depositamos muita esperança e não vingou
Como Eliandro…";2019-03-18 06:47:58
"57";57;"0.622545897960663";"Daqui a poucoda manhã tem Bola na Rede na redetv Veja os principais destaques



corinthians…";2019-03-18 01:02:55
"58";58;"0.483805418014526";"Emprego para Operador de caixaPCD R";2019-03-18 01:01:14
"59";59;"0.480601727962494";"Cruzeirooooooo Cruzeiro Eivamos buscar mais um título de expressão em";2019-03-18 00:42:36
"60";60;"1";"Foi salvo aosdo segundo tempo hein<U+0001F602><U+0001F602><U+0001F602><U+0001F602> Cruzeirão Cabuloso segue invicto Cruzeiro no Fantástico";2019-03-17 23:25:16
"61";61;"0.588128328323364";"Alô Tadeu Schmidt Tem invicto emsimFantástico Cruzeiro";2019-03-17 23:16:42
"62";62;"0.704622328281403";"Melhoria ourocom nenhum jogador ouro raro kkkk Kane Fifa 
…";2019-03-17 22:39:09
"63";63;"0.756816029548645";"Mais do que um clássico no futebol de várzea de BH um grande encontro de amigos futebol classicomineiro…";2019-03-17 22:33:23
"64";64;"0.5";"Cruzeiro cruzeiro";2019-03-17 20:51:39
"65";65;"0.755199670791626";"Com as derrotas de América Vasco e Goiásé o único invicto do Brasil no ano
cruzeiro";2019-03-17 19:48:32
"66";66;"0.535747766494751";"Não precisa nem pensar duas vezesJá podem fazer a negociação SassáEveraldo Cruzeirov…";2019-03-17 19:37:11
"67";67;"0.413511246442795";"Raposinha Tia Coxinha Raposão e eu Formou o bonde niverdorafa anosdorafa araposamaislindadomundo…";2019-03-17 18:49:24
"68";68;"0.802215337753296";"CABULOSO DIMAIS <U+0001F499><U+0001F98A>











cruzeirodadepre Cruzeiro CruzeiroEsporteClube MaiordeMinas…";2019-03-17 18:40:05
"69";69;"0.619856655597687";"Neste vídeo mostramos o que fizemos nas paradas do navio em St Marteen visita a St Barths e St Lucia durante o c…";2019-03-17 18:26:02
"70";70;"0.343972325325012";"Quero só ver o público do CruzeiroMG Futebol Club vaidoso e do AméricaMG de BH que jogarão em casa na próxima r…";2019-03-17 18:07:08
"71";71;"0.5";"MINEIRO gtgtgt








cruzeirodadepre Cruzeiro CruzeiroEsporteClube MaiordeMinas CruzeirãoCabuloso…";2019-03-17 17:58:04
"72";72;"0.43801885843277";"definitivamente líder do Mineiro Fica a briga pelo segundo lugarouTudo para a…";2019-03-17 17:57:16
"73";73;"0.171629965305328";"torcedores e sóde renda Ingresso aSó não lançou o público pagante pra não passar vergonha Cruzeiro";2019-03-17 17:48:53
"74";74;"0.674767136573792";"Cruzeiro pelo Rio Sena <U+0001F6A2> riosena frança paris europa cruzeiro amei em BATEAUX PARISIENS";2019-03-17 17:39:55
"75";75;"0.384124279022217";"No AquiComBenja desse final de semana ThiagoNeves do cruzeiro fala sobre desarrascaeta no flamengo e olha que está…";2019-03-17 16:24:22
"76";76;"1";"KoéGidão <U+0001F60E> 
Haha maispontos pra nós
Boaaaa Cruzeiro <U+0001F499><U+0001F43A>
NasBatalhasComOCruzeiro 
CruzeiroCabuloso 
Cruzeiro 
VamosL…";2019-03-17 16:08:43
"77";77;"0.502121448516846";"A IMAGEM DO CRUZEIRO RESPLANDECE <U+0001F535><U+26AA><U+FE0F><U+0001F98A> TUPxCRU NasBatalhasComOCruzeiro";2019-03-17 15:44:23
"78";78;"0.901934623718262";"Um ano já se passaram
O amor pelo Cruzeiro continua o mesmo
Satisfação em revelo amigo Tintim
A rua é Azul…";2019-03-17 15:02:56
"79";79;"0.741625964641571";"Nós do Bloco Raposão de São João Del Rei já somos
Já abriu sua conta 
Além de várias vantagens você s…";2019-03-17 14:45:31
"80";80;"0.5";"FRED <U+0001F525>

• Pelo Cruzeiro
 JogosGols



• EM 
 golsjogos";2019-03-17 14:27:12
"81";81;"0.512014031410217";"Saiu o resultado da enquete do cartola sobre a precificações de jogadores e ai concorda deixa ai nos comentários …";2019-03-17 14:17:21
"82";82;"0.553960025310516";"Galera saiu a primeira precificação do Cartola FCKannemanncartoletas o que acharam comenta ai …";2019-03-17 13:07:17
"83";83;"0.726993560791016";"Hoje tem desfile na quadra do CO àshrspra rainha do Cruzeiro aparece lá galera eu vou desfilar";2019-03-17 13:05:33
"84";84;"0.449858665466309";"O Cruzeiro jogou bem mas também não foi forçado por parte do Tupi…";2019-03-17 12:53:49
"85";85;"0.622461795806885";"<U+0001F913>

Valewww cabuloso Mais uma Vitória pra conta

NasBatalhasComOCruzeiro Cruzeiro MeuMantoÉSagrado FechadaComOCruz…";2019-03-17 12:16:36
"86";86;"0.201480746269226";"Na dúvida comprei as duas 
Não dá pra saber qual a mais linda
 
Cruzeiro 
CruzeiroCabuloso
C…";2019-03-17 11:10:42
"87";87;"0.450491905212402";"Recémchegado aoo lateral esquerdo Ryan tem se destacado nos treinos e jogos preparatórios pra Copa do Brasil…";2019-03-17 10:50:07
"88";88;"0.690921008586884";"Trio Cruzeirao Cabuloso cruzeiro labestianegra cruzeirocabuloso fechadocomocruzeiro em Parque Ibirapuera Conser…";2019-03-17 10:40:07
"89";89;"0.747560918331146";"Quando tá valendo o Cruzeiro ganha hahaha";2019-03-17 10:29:15
"90";90;"0.406708300113678";"O rebaixado Tupi joga muito mal entrega dois gols para o Cruzeiro e denovo um gol solitário salva o time de azul…";2019-03-17 10:11:28
"91";91;"0.6100714802742";"<U+0001F504>Substituição no Cruzeiro

<U+2B06><U+FE0F>Jadson
<U+2B07><U+FE0F>Rodriguinho 

Se liga na informação sobre Cruzeiro x Dep Lara…";2019-03-17 10:06:48
"92";92;"1";"GOLAÇO de FALTA BoaCruzeiro 
Melhores Momentos<U+26BD> com Bom Humor FM<U+0001F602><U+0001F602><U+0001F602>
Assista no Canal Caveira Azul d…";2019-03-17 08:47:39
"93";93;"0.445791661739349";"E VC ESTÁ ILUDIDO TB 











cruzeirodadepre Cruzeiro CruzeiroEsporteClube MaiordeMinas…";2019-03-17 08:37:01
"94";94;"0.585275530815125";"<U+0001F535>Atenção torcida Celeste meu pós de Cruzeiro x Tupi CRUZEIRO NasBatalhasComOCruzeiro";2019-03-17 08:31:24
"95";95;"0.384124279022217";"No AquiComBenja desse final de semana ThiagoNeves do cruzeiro fala sobre desarrascaeta no flamengo e olha que…";2019-03-17 08:17:09
"96";96;"0.954545438289642";"Quando o Cabuloso ganha nois fica como
Haha só o Mano <U+0001F499>
Aaaaah ser Cruzeiro é bom demais <U+0001F3B5><U+0001F499><U+0001F43A>
Bom diaaaa naç…";2019-03-17 07:55:23
"97";97;"0.493194758892059";"E REPETIMOS MAIS UMA VEZ NUNCA DUVIDEM DO CRUZEIRO O CRUZEIRO CHEGA O CRUZEIRO CONQUISTA";2019-03-17 02:54:14
"98";98;"0.97514545917511";"Esse grande projeto da conta Digi com o time Cruzeiro promete hein

Confira a reportagem exclusiva do …";2019-03-17 02:04:33
"99";99;"0.897499322891235";"Assistir aos jogos dojá é bom Assistir aos jogos do Cruzeiro ao lado de grandes cruzeirenses como o…";2019-03-17 00:43:28
"100";100;"0.421800285577774";"Acompanhe conosco a PRECIFICAÇÃO do Cartola FCPróxima segundaQuem arisca o valor de Ricardo Goulart…";2019-03-17 00:37:59
"101";101;"1";"Assistir aos jogos dojá é bom Assistir aos jogos do Cruzeiro ao lado de grandes cruzeirenses é melhor…";2019-03-17 00:34:56
"102";102;"0.712530314922333";"Aagradece a todos os departamentos do Cruzeiro que nos proporcionaram momentos únicos toda vez que vem…";2019-03-17 00:03:32
"103";103;"0.757521152496338";"Hoje h tem mais um AquiComBenja daqueles que vai dar o que falar ThiagoNeves do Cruzeiro falando tudo e um pouco…";2019-03-16 23:53:02
"104";104;"0.705505192279816";"<U+0001F504>Substituição no Cruzeiro

<U+2B06><U+FE0F>David
<U+2B07><U+FE0F>Robinho 

Se liga na informação sobre Cruzeiro x Dep Lara

CON…";2019-03-16 22:48:22
"105";105;"0.414614886045456";"BOLA EM JOGO EM JUIZ DE FORA

COMEÇA TUPI X CRUZEIRO PELO CAMPEONATO MINEIRO

VVVVVAAAAAMMMMMOOOOOSSSSS…";2019-03-16 22:39:47
"106";106;"0.79390150308609";"Agora nacom Tupi x Cruzeiro Vale a vida pro Tupi mas o Cruzeiro vai com time titular
Promete
…";2019-03-16 22:21:12
"107";107;"0.197092175483704";"Não sou cruzeirense e que me desculpe o Tupi mas jantei hoje com o time dolá na potenciadosuljfDa hor…";2019-03-16 21:12:02
"108";108;"0.0454545468091965";"VoleiNoSporTV o CRUZEIRO está escolhendo adversario pra fase final Ta jogando muito mal hoje Desrespeito com a torcida isso é FEIO<U+0001F623>";2019-03-16 20:57:21
"109";109;"0.565958559513092";"VoleiNoSporTV o CRUZEIRO ainda vai virar";2019-03-16 20:52:15
"110";110;"0.576762080192566";"Reduto FanatiZeiros já adquirimos
Adquira o seu e tornase um colaborador financeiro do cruzeiro …";2019-03-16 20:00:11
"111";111;"0";"VoleiNoSporTVtem uma explicação porque o CRUZEIROnestes ultimos jogos está pior noset e ate perdendo noset";2019-03-16 19:50:25
"112";112;"0.610500335693359";"Com cinco gols no Mineiro Fred agora iguala Ricardo Oliveira e Alerrandro na artilharia do Estadual Emele foi o…";2019-03-16 19:45:57
"113";113;"0.825871050357819";"HOJE TEM CRUZEIRO <U+0001F535><U+26AA><U+0001F98A>

Cruzeiro NasBatalhasComOCruzeiro HojeTemCruzeiro Edits

<U+0001F4FD><U+FE0F> Gol de RafinhaCruzeiro x Tupi…";2019-03-16 19:45:38
"114";114;"1";"VoleiNoSporTV sempre bom assistir meu CRUZEIRO e com os comentarios dofica melhor ainda <U+0001F929>";2019-03-16 19:43:30
"115";115;"0.85696405172348";"Com a vitória x sobre o TUPI ManoMenezes chega às vitorías com o cruzeiro<U+0001F44A><U+0001F3FC><U+26AA><U+FE0F><U+0001F535><U+0001F98A>";2019-03-16 19:42:56
"116";116;"0.944087743759155";"Vamos Sada Cruzeiro <U+0001F4AA><U+0001F3FB><U+0001F98A><U+0001F499><U+0001F44A><U+0001F3FB>
VamoSadaCruzeiro Superliga SadaCruzeiro Cruzeiro NasBatalhasComOCruzeiro";2019-03-16 19:28:54
"117";117;"0.457434713840485";"Recémchegado aoo lateral esquerdo Ryan tem se destacado nos treinos e jogos preparatórios pra Copa do B…";2019-03-16 19:00:28
"118";118;"0.524771153926849";"Muito semelhante Veja a comparaçãocruzeiro superfc";2019-03-16 18:50:16
"119";119;"0.629925131797791";"Um gol contra deu início a goleada do Cruzeiro que completou o placar com Fred e Egídio O time ocupa acolocação no…";2019-03-16 18:49:52
"120";120;"0.534953713417053";"O Rei dos stories está de volta hahahahaha

Fred
ReiDosStories
Cruzeiro";2019-03-16 18:38:27
"121";121;"0.475631475448608";"<U+0001F504>Substituição no Cruzeiro

<U+2B06><U+FE0F>Marquinhos Gabriel
<U+2B07><U+FE0F>Rafinha

Me siga nas Redes Sociais";2019-03-16 18:28:46
"122";122;"0.545437097549438";"Eu assistindo o jogo do cruzeiro

O narrador falava Egídio e eusóentendia Messi <U+0001F937><U+200D><U+2642><U+FE0F><U+0001F632>

cruzeiroRaposaSegueRaposa";2019-03-16 18:24:15
"123";123;"0.622461795806885";"<U+0001F913>

Valewww cabuloso Mais uma Vitória pra conta

NasBatalhasComOCruzeiro Cruzeiro MeuMantoÉSagrado…";2019-03-16 18:21:06
"124";124;"0.709822058677673";"Salve Confraria Já estamos com grupo deno WhatsApp 
Quem curte CartolaFC e futebol é só deixar o número no…";2019-03-16 18:18:37
"125";125;"0.798746585845947";"VITÓRIA DA RAPOSA <U+0001F535><U+26AA>

Cruzeiro vence porarebaixa o Tupi e fica perto do líder AtléticoMG

Siga …";2019-03-16 18:17:38
"126";126;"0.636112034320831";"Um gol contra deu início a goleada do Cruzeiro que completou o placar com Fred e Egídio O time ocupa acolocaç…";2019-03-16 18:11:33
"127";127;"0.808355331420898";"Gidão pscininha amor marcando um golaço hahahahah TUPxCRU NasBatalhasComOCruzeiro RaposaSegueRaposa Cruzeiro";2019-03-16 18:09:26
"128";128;"1";"KoéGidão <U+0001F60E> 
Haha maispontos pra nós
Boaaaa Cruzeiro <U+0001F499><U+0001F43A>
NasBatalhasComOCruzeiro 
CruzeiroCabuloso 
Cruzeiro…";2019-03-16 18:08:30
"129";129;"0.616556942462921";"Cruzeiro x Caldense poderá ser decisivo para a colocação final do time celeste na tabela Tudo dependerá do clássi…";2019-03-16 18:02:04
"130";130;"0.494874238967896";"MANTENHA SEU MEIO DE TRABALHO FUNCIONANDO";2019-03-16 18:00:02
"131";131;"0.93478262424469";"Em um jogo de ótima atuação Cruzeiro vence sem sustos e rebaixa o Tupi por a Destaque para o belo gol de Egídio…";2019-03-16 17:58:15
"132";132;"1";"Final de jogo TUPXCRU em um treino de luxo pro Cruzeiro e quem foi o melhor em campo";2019-03-16 17:56:29
"133";133;"0.441100716590881";"Egídio nunca critiquei
Cruzeiro";2019-03-16 17:55:33
"134";134;"0.923800587654114";"Cruzeiro venceu o Tupi Time de Juiz de Fora disputará o MóduloemAtuação excelente de Marquinhos Gabrie…";2019-03-16 17:54:56
"135";135;"0.847915887832642";"Fim de jogo

Tupi x Cruzeiro
Gols Contra valeu zagueiro Fred e Egídio";2019-03-16 17:54:47
"136";136;"0.54075562953949";"Fim De Jogo

Tupi x Cruzeiro 

SabadoDetremuraSDV FOLLOWTRICK";2019-03-16 17:53:14
"137";137;"1";"BOA CRUZEIRO <U+0001F4AA><U+0001F3FB><U+0001F98A><U+0001F499><U+0001F44A><U+0001F3FB>
PONTOS <U+0001F44F><U+0001F3FB><U+0001F44F><U+0001F3FB><U+0001F44F><U+0001F3FB>
CampeonatoMineiro TUPxCRU NasBatalhasComOCruzeiro Cruzeiro";2019-03-16 17:52:53
"138";138;"0.282654166221619";"Essa falta Egidio colocou com as mãos Cruzeiro TUPxCRU NossoFutebol Mineiro Fred Egidio";2019-03-16 17:52:12
"139";139;"0.418405592441559";"Substituição no Cruzeiro

Saiu Rodriguinho
Entrou Jadson";2019-03-16 17:46:57
"140";140;"0.6100714802742";"<U+0001F504>Substituição no Cruzeiro

<U+2B06><U+FE0F>Jadson
<U+2B07><U+FE0F>Rodriguinho 

Se liga na informação sobre Cruzeiro x…";2019-03-16 17:46:46
"141";141;"0.5";"Golaço EgídioCruzeiro";2019-03-16 17:44:20
"142";142;"0.54075562953949";"Gool do cruzeiro

Tupi x Cruzeiro 

SabadoDetremuraSDV FOLLOWTRICK";2019-03-16 17:44:09
"143";143;"0.408330738544464";"Que ito EgiDeus pqp GOLAÇO CRUZEIRO";2019-03-16 17:43:03
"144";144;"0.547719955444336";"Cruzeiro vai rebaixar o galo no mineiro Cruzeiro";2019-03-16 17:35:22
"145";145;"0.426237195730209";"Substituição no Cruzeiro

Saiu Robinho 
Entrou David";2019-03-16 17:33:23
"146";146;"0.6100714802742";"<U+0001F504>Substituição no Cruzeiro

<U+2B06><U+FE0F>David
<U+2B07><U+FE0F>Robinho 

Se liga na informação sobre Cruzeiro x Dep…";2019-03-16 17:32:22
"147";147;"0.45924836397171";"Quarto gol impedido do Cruzeirão nos últimosjogos TUPxCRU Cruzeiro";2019-03-16 17:27:25
"148";148;"0.586623191833496";"Isso aí galera
RedutosCelestes Cruzeiro";2019-03-16 17:22:27
"149";149;"0.5908043384552";"CRUZEIRO Fábio Edílson Dedé Léo e Egídio Henrique Lucas Romero Robinho Rodriguinho e Rafinha Fred";2019-03-16 17:11:28
"150";150;"0.472026824951172";"Começa otempo

Tupi x Cruzeiro";2019-03-16 17:03:50
"151";151;"0.5";"CampeonatoMineiro
Intervalo de Jogo
Tupix Cruzeiro 
Ouça";2019-03-16 17:02:27
"152";152;"0.355713069438934";"HojeEmDia Ederson Cacá e Michel são cedidos ao time sub do Cruzeiro para disputa da Copa do Brasil gt";2019-03-16 17:01:02
"153";153;"0.847915887832642";"Fim dotempo

Tupi x Cruzeiro
Gols Contra valeu zagueiro e Fred";2019-03-16 16:50:55
"154";154;"0.54075562953949";"Intervalo

Tupi x Cruzeiro 

SabadoDetremuraSDV";2019-03-16 16:48:51
"155";155;"0.492363661527634";"Já baixou o aplicativo da conta do Cruzeiro no seu celular Espia só o que espera por você

<U+0001F4B3> Solicite cartão de créd…";2019-03-16 16:48:45
"156";156;"0.437440365552902";"Substituição no Cruzeiro

Saiu Rafinha 
Entrou Marquinhos Gabriel";2019-03-16 16:44:24
"157";157;"0.475631475448608";"<U+0001F504>Substituição no Cruzeiro

<U+2B06><U+FE0F>Marquinhos Gabriel
<U+2B07><U+FE0F>Rafinha

Me siga nas Redes Sociais…";2019-03-16 16:43:58
"158";158;"1";"Cruzeiroeu tô amando as redes do jogo por mais redes efeito arco íris <U+2764><U+0001F308>";2019-03-16 16:43:00
"159";159;"0.679279148578644";"Titularidade mais que merecida <U+0001F44F><U+0001F44F><U+0001F44F><U+0001F44F><U+0001F44F> El Perro <U+0001F436> joga demaaaais
Vamooooos Cruzeiro 
Aumentar esse p…";2019-03-16 16:42:36
"160";160;"0.677247643470764";"O grau de concentração do Cruzeiro baixou com os gols no início Quando aperta chega bem ao ataque e cria chances…";2019-03-16 16:38:27
"161";161;"0.63739687204361";"Bora Cruzeiro";2019-03-16 16:34:36
"162";162;"0.843345165252686";"Vamos a ganhar Cruzeiro ContinuarAGanharNoCaso";2019-03-16 16:24:50
"163";163;"0.805628538131714";"Adendo para Gustavo Henriquedo Boa Esporte também artilheiro do Estadual com cinco golscruzeiro tupxcru superfc";2019-03-16 16:23:29
"164";164;"0.51403284072876";"Dois vacilos individuais e umxa favor pro Cruzeiro Time celeste conta com o auxílio do abalado psicológico…";2019-03-16 16:23:05
"165";165;"0.600872278213501";"Com cinco gols no Mineiro Fred agora iguala Ricardo Oliveira e Alerrandro na artilharia do Estadual Emele…";2019-03-16 16:21:41
"166";166;"0.526639997959137";"<U+26BD><U+FE0F> Cruzeiro escalado aqui em Juiz de Fora Fábio Edílson Dedé Léo e Egídio Henrique Lucas Romero Robinho Rodrigu…";2019-03-16 16:21:33
"167";167;"1";"Vamos vamos Cruzeiro
Vamos vamos a ganhar
Já começamos o jogo bem dominando quero ver mais gols…";2019-03-16 16:09:00
"168";168;"0.311415761709213";"Zagueiro do Tupi foi cortar o cruzamento do Robinho e acabou fazendo contra

Tupi x Cruzeiro";2019-03-16 16:03:45
"169";169;"0.385246813297272";"Cruzeiro esse time do Tupi é medonho";2019-03-16 16:03:18
"170";170;"0.505541205406189";"Começa o jogo

Tupi x Cruzeiro";2019-03-16 16:02:14
"171";171;"0.54075562953949";"Bola Rolando
Cruzeiro x Tupi

SabadoDetremuraSDV";2019-03-16 16:01:03
"172";172;"0.946855545043945";"Vamos Cruzeiro <U+0001F4AA><U+0001F3FB><U+0001F98A><U+0001F499><U+0001F44A><U+0001F3FB>
CampeonatoMineiro TUPxCRU NasBatalhasComOCruzeiro Cruzeiro";2019-03-16 16:00:03
